{
  "schema_version": "1.0",
  "snapshot_id": "MFM_1_6_CHAOS_TITAN_LEGIONS",
  "edition": "11e",
  "mfm_version": "1.6",
  "official_last_updated": "2026-10-14",
  "content_first_seen": "2026-10-14",
  "faction": {
    "slug": "chaos-titan-legions",
    "name": "Chaos Titan Legions",
    "parent": null
  },
  "provenance": {
    "normative_source_id": "GW_MFM",
    "extraction_source_id": "BSDATA_MFM_11E",
    "extraction_repository": "BSData/wh40k-11e-mfm",
    "extraction_commit": "2b2aa1fa7b4d6a65f36b26905713b9b2eae22a31",
    "extraction_path": "data/chaos-titan-legions.yaml",
    "extraction_blob_sha": "60e2535ced232e9ea565ff939761465870093524",
    "normalized_at": "2026-10-20"
  },
  "summary": {
    "units": 4,
    "detachments": 0,
    "pricing_rows": 4,
    "leader_relations": 0,
    "support_relations": 0,
    "wargear_cost_entries": 0,
    "enhancement_cost_entries": 0,
    "legends_units": 0
  },
  "detachments": [],
  "units": [
    {
      "name": "Chaos Reaver Titan",
      "pricing": [
        {
          "range": "[1,)",
          "label": "Your Unit Costs",
          "costs": [
            {
              "models": 1,
              "points": 2200
            }
          ]
        }
      ]
    },
    {
      "name": "Chaos Warbringer Nemesis Titan",
      "pricing": [
        {
          "range": "[1,)",
          "label": "Your Unit Costs",
          "costs": [
            {
              "models": 1,
              "points": 2600
            }
          ]
        }
      ]
    },
    {
      "name": "Chaos Warhound Titan",
      "pricing": [
        {
          "range": "[1,)",
          "label": "Your Unit Costs",
          "costs": [
            {
              "models": 1,
              "points": 1100
            }
          ]
        }
      ]
    },
    {
      "name": "Chaos Warlord Titan",
      "pricing": [
        {
          "range": "[1,)",
          "label": "Your Unit Costs",
          "costs": [
            {
              "models": 1,
              "points": 3500
            }
          ]
        }
      ]
    }
  ]
}
